,en,de,en_task
728,"8 And it shall come to pass that whosoever shall a believe on the Son of God , the same shall have everlasting life .","8 Und es wird sich begeben : Wer auch immer an den Sohn Gottes a glaubt , derjenige wird immerwährendes Leben haben .","translate English to German: 8 And it shall come to pass that whosoever shall a believe on the Son of God , the same shall have everlasting life ."
729,"We intend to be proactive and know that , in all the issues which we discuss , we will need the active support of Parliament .","Wir rechnen mit einer aktiven Arbeit und wissen , dass wir in allen zu behandelnden Fragen die volle Unterstützung des Europäischen Parlaments benötigen .","translate English to German: We intend to be proactive and know that , in all the issues which we discuss , we will need the active support of Parliament ."
732,"For orders above € 100,00 we will take care of the shipping costs !","Bei Bestellungen mehr als € 100,00 übernehmen wir die Versandkosten !","translate English to German: For orders above € 100,00 we will take care of the shipping costs !"
734,"I know that my site can be subject to withholding in the Land of the Two Holy and sisters .. .. Ihajabuh But I mean , but I understand why no other means , Arab media and human rights group Arbawip ago .. Said or whispered , or ..","Ich weiß , dass meine Website unterliegen kann Quellensteuer im Land der zwei Heiligen und Schwestern .. .. Ihajabuh Aber ich meine , aber ich verstehe , warum kein anderes Mittel , Arabische Medien und Menschenrechtsorganisationen Gruppe Arbawip vor .. Said oder geflüstert , oder ..","translate English to German: I know that my site can be subject to withholding in the Land of the Two Holy and sisters .. .. Ihajabuh But I mean , but I understand why no other means , Arab media and human rights group Arbawip ago .. Said or whispered , or .."
735,Everyone must now pull together to make it happen and achieve the objectives that we first set out for ourselves when we agreed the Doha Charter all those years ago .,"Jeder muss nun am gleichen Strang ziehen , damit wir das schaffen und die Ziele erreichen , die wir uns eingangs gesteckt haben , als wir vor so vielen Jahren die Charta von Doha vereinbarten .",translate English to German: Everyone must now pull together to make it happen and achieve the objectives that we first set out for ourselves when we agreed the Doha Charter all those years ago .
736,Description : Make yourself at home in Lollis Homestay !,Beschreibung : Fühl dich wie Zuhause in Lollis Homestay !,translate English to German: Description : Make yourself at home in Lollis Homestay !
738,"Independent therefrom , any Ordering Party is obliged to pass on all booking-related information to the Guest , in particular the present General Terms and Conditions .","Davon unabhängig ist jeder Besteller verpflichtet , alle buchungsrelevanten Informationen , insbesondere diese Allgemeine Geschäftsbedingungen , an den Gast weiterzuleiten .","translate English to German: Independent therefrom , any Ordering Party is obliged to pass on all booking-related information to the Guest , in particular the present General Terms and Conditions ."
739,"There is a strategy for this part of Central Asia , it will be reviewed , but I am looking at it in the context of the External Action Service and what we should be doing within this region to pull together the different elements of Commission and Council support .","Es gibt eine Strategie für diesen Teil Zentralasiens , sie wird überprüft werden , aber ich schaue auf sie im Zusammenhang mit dem Auswärtigen Dienst und was wir in dieser Region tun sollten , um die verschiedenen Hilfen von Kommission und Rat zusammenzuziehen .","translate English to German: There is a strategy for this part of Central Asia , it will be reviewed , but I am looking at it in the context of the External Action Service and what we should be doing within this region to pull together the different elements of Commission and Council support ."
741,Art is the means to pass on these experiences .,"Kunst ist das Mittel , diese Erfahrungen weiterzugeben .",translate English to German: Art is the means to pass on these experiences .
742,I did hear you .,– Ich habe Sie gehört .,translate English to German: I did hear you .
743,"They deal with these reports in accordance with established procedures and pass them on as appropriate to police , Internet service providers and other hotlines .","Die Hotlines bearbeiten diese Informationen nach einem vorgeschriebenen Verfahren und leiten sie an die zuständigen Behörden wie Polizei , Internet-Diensteanbieter und andere Hotlines weiter .","translate English to German: They deal with these reports in accordance with established procedures and pass them on as appropriate to police , Internet service providers and other hotlines ."
745,So a key goal of Clinton ’ s visit must be to pull together with the Asian leaders present at the ASEAN Regional Forum .,"Daher muss die Zusammenarbeit mit den asiatischen Machthabern , die beim ASEAN Regional Forum anwesend sein werden , ein entscheidendes Ziel von Clintons Besuch sein .",translate English to German: So a key goal of Clinton ’ s visit must be to pull together with the Asian leaders present at the ASEAN Regional Forum .
746,"I have taken note of the various points of view , and I can assure you that I shall pass them on to my colleagues in the Council .","Ich habe die verschiedenen Ansichten zur Kenntnis genommen und kann Ihnen versichern , dass ich meine Kollegen im Rat entsprechend informieren werde .","translate English to German: I have taken note of the various points of view , and I can assure you that I shall pass them on to my colleagues in the Council ."
748,"In order to minimise such instances , we decided to pass on our expertise in the form of lectures held at the meetings of the Slovenian Maintenance Staff Association .","Um solche Fälle weitgehend zu vermeiden , entschieden wir uns , unsere Fachkenntnisse in der Form von Vorlesungen bei den Zusammenkünften des Slowenischen Wartungspersonalsverbands an alle Interessengruppen weiterzuleiten .","translate English to German: In order to minimise such instances , we decided to pass on our expertise in the form of lectures held at the meetings of the Slovenian Maintenance Staff Association ."
749,I will certainly pass it on to a group of charity workers in my constituency who are trying to organize a trip to the European Union .,"Ich werde sie an eine Gruppe von Sozialarbeitern in meinem Wahlkreis weiterleiten , die eine Reise durch die Europäische Union planen .",translate English to German: I will certainly pass it on to a group of charity workers in my constituency who are trying to organize a trip to the European Union .
750,"Mr President , Commissioner , UNITA is without a shadow of a doubt guilty of restarting the war in Angola and must therefore be held responsible . It has not abided by the election results , it has prevented the demilitarisation of its forces and the extension of the state administration to the whole territory and it has disregarded the Lusaka protocol and the recommendations of the UN Security Council .","Da die UNITA sich nicht mit den Wahlergebnissen abfindet , da sie die Entmilitarisierung ihrer Streitkräfte und die Ausweitung der Staatsverwaltung auf das gesamte Staatsgebiet verhindert hat , da sie die Abkommen von Lusaka und die Empfehlungen des UN-Sicherheitsrates mißachtet , ist sie ohne den geringsten Zweifel für den erneuten Ausbruch des Krieges in Angola verantwortlich , und als solche muß sie verantwortlich gemacht werden .","translate English to German: Mr President , Commissioner , UNITA is without a shadow of a doubt guilty of restarting the war in Angola and must therefore be held responsible . It has not abided by the election results , it has prevented the demilitarisation of its forces and the extension of the state administration to the whole territory and it has disregarded the Lusaka protocol and the recommendations of the UN Security Council ."
751,The European Agency for the Management of the External Borders still does not have a permanent seat .,Die Europäische Agentur für die operative Zusammenarbeit an den Außengrenzen hat noch immer keinen ständigen Sitz .,translate English to German: The European Agency for the Management of the External Borders still does not have a permanent seat .
752,One of them in my constituency will be faced with going out of business because there is no way he will be able to sell his components to the oil and gas industry in the United States .,"Einer dieser Unternehmer aus meinem Wahlkreis wird sich zur Schließung seines Unternehmens gezwungen sehen , da er dann nicht mehr in der Lage sein wird , seine Komponenten an die Öl- und Gasindustrie in den USA zu verkaufen .",translate English to German: One of them in my constituency will be faced with going out of business because there is no way he will be able to sell his components to the oil and gas industry in the United States .
753,I hope that someone will pass on to him what was said .,"Jemand wird ihm hoffentlich mitteilen , worum es hier ging .",translate English to German: I hope that someone will pass on to him what was said .
754,"In this respect , it is quite clear that the way we deal with Greece will be crucial but I want to insist that Greece has been treated in the same way as all the other countries when their situation was considered back in 1998 .","In dieser Hinsicht ist völlig klar , daß es von grundlegender Bedeutung sein wird , was wir mit Griechenland machen , aber ich betone , daß mit Griechenland nichts anderes getan wurde als mit den übrigen Ländern bei der Analyse ihrer Situation im Jahre 1998 .","translate English to German: In this respect , it is quite clear that the way we deal with Greece will be crucial but I want to insist that Greece has been treated in the same way as all the other countries when their situation was considered back in 1998 ."
755,"Mr Oettinger , in the face of the drama in the Gulf of Mexico , drilling installations for extracting crude oil or gas should never be allowed to appear without a 100 % guarantee of safety for the seas and oceans concerned .","Herr Oettinger , angesichts des Dramas im Golf von Mexiko sollten Bohranlagen zur Förderung von Öl oder Gas niemals ohne eine 100 % -ige Sicherheitsgarantie für die betroffenen Meere und Ozeane gebaut werden .","translate English to German: Mr Oettinger , in the face of the drama in the Gulf of Mexico , drilling installations for extracting crude oil or gas should never be allowed to appear without a 100 % guarantee of safety for the seas and oceans concerned ."
756,It was also clear to us that the &apos; bonus culture &apos; could not continue in the way in which people had become used to .,"Wir waren uns auch darüber im Klaren , dass die &quot; Bonuskultur &quot; nicht weiterhin wie gewohnt beibehalten werden konnte .",translate English to German: It was also clear to us that the &apos; bonus culture &apos; could not continue in the way in which people had become used to .
757,"I know that my site can be subject to withholding in the Land of the Two Holy brothers and sisters .. .. Ihajabuh بس mean me understand Leach and no way to Arab media and human rights group Arbawip almost .. Said or whispered , or .. A glimpse of the subject ..","Ich weiß , dass meine Website unterliegen der Quellensteuer im Land der zwei heiligen Brüder und Schwestern .. .. Ihajabuh können بس meine mich zu verstehen Leach und keine Möglichkeit , die arabischen Medien und Menschenrechtsorganisationen Gruppe Arbawip fast .. Said oder leise , oder .. Ein Blick in das Thema ..","translate English to German: I know that my site can be subject to withholding in the Land of the Two Holy brothers and sisters .. .. Ihajabuh بس mean me understand Leach and no way to Arab media and human rights group Arbawip almost .. Said or whispered , or .. A glimpse of the subject .."
758,"The only people who ever knew their precise location were those whom Wormtail had told directly , but none of them would have been able to pass on the information .","Die einzigen , die jemals den genauen Ort kannten , waren jene , die ihn direkt von Wurmschwanz erfahren hatten , aber keiner von ihnen hätte die Information weitergeben können .","translate English to German: The only people who ever knew their precise location were those whom Wormtail had told directly , but none of them would have been able to pass on the information ."
759,"This loss is paid for by those who sit up there in the public gallery , the European man in the street , and so long as you are not prepared to pass on the costs in full and therefore also to put money in the alternatives , the shameful political fight will continue against justice on the roads of Europe .","Für diese Schäden zahlen diejenigen , die hier oben auf den Tribünen sitzen , d.h. der kleine Mann in Europa , und solange ihr nicht bereit seid , die Kosten voll umzulegen und dann auch das Geld in die Alternativen zu stecken , so lange ist das niederer politischer Kampf gegen Gerechtigkeit auf Europas Straßen .","translate English to German: This loss is paid for by those who sit up there in the public gallery , the European man in the street , and so long as you are not prepared to pass on the costs in full and therefore also to put money in the alternatives , the shameful political fight will continue against justice on the roads of Europe ."
760,"We know that Algeria &apos;s problems have to be solved by the Algerians themselves , but in maintaining relations between the European Union and Algeria and in the new framework for those relations , Europe must not forget that its own essence is based on democracy and respect for human rights , and it cannot turn a blind eye to a situation which flouts the most elementary standards of universal democracy .","Wir wissen , daß nur die Algerier selbst die Probleme Algeriens lösen können , doch bei den Beziehungen , die die Europäische Union mit Algerien unterhält , und angesichts des neuen Rahmens der Beziehungen darf Europa nicht vergessen , worauf das eigene Wesen sich gründet , nämlich die Demokratie und die Achtung der Menschenrechte , ebenso wie die Nicht-Ignorierung einer Situation , die weit von der elementarsten Norm der universellen Demokratie entfernt ist .","translate English to German: We know that Algeria &apos;s problems have to be solved by the Algerians themselves , but in maintaining relations between the European Union and Algeria and in the new framework for those relations , Europe must not forget that its own essence is based on democracy and respect for human rights , and it cannot turn a blind eye to a situation which flouts the most elementary standards of universal democracy ."
761,I would ask you to pass on our thanks to all the services involved in moving us into our new offices in Brussels for the way this was carried out .,"Ich möchte Sie bitten , all den betroffenen Diensten unseren Dank dafür auszusprechen , wie sie uns beim Umzug in unsere neuen Büros in Brüssel geholfen haben .",translate English to German: I would ask you to pass on our thanks to all the services involved in moving us into our new offices in Brussels for the way this was carried out .
764,"Some companies , even in this day and age , are unsure of the advantages of having a presence on the Internet for their business .","Einige Unternehmen , auch in der heutigen Zeit , sind nicht von den Vorteilen , die eine Präsenz im Internet für ihr Geschäft .","translate English to German: Some companies , even in this day and age , are unsure of the advantages of having a presence on the Internet for their business ."
766,"We feel that people ’ s individual and collective identity is formed by their collective memory and that this must be brought to the fore , so that we can all be aware of where we come from and define where we want to go .","Wir sind der Auffassung , dass die individuelle und kollektive Identität der Menschen von ihrem kollektiven Gedächtnis gebildet wird und dass dies in den Vordergrund gerückt werden muss , damit wir alle erfahren können , woher wir kommen , und bestimmen können , wohin wir gehen .","translate English to German: We feel that people ’ s individual and collective identity is formed by their collective memory and that this must be brought to the fore , so that we can all be aware of where we come from and define where we want to go ."
769,Asthetically printmaking is connected to drawing and painting while working on the plate can pass into the area of sculpture .,"Ästhetisch verbindet sie viel mit Zeichnung und Malerei , wobei die Plattenbearbeitung in den Bereich der Plastik übergehen kann .",translate English to German: Asthetically printmaking is connected to drawing and painting while working on the plate can pass into the area of sculpture .
771,"Mr President , it is highly likely that Ireland will be the only European country to hold a referendum on the Lisbon Treaty .","( EN ) Herr Präsident ! Sehr wahrscheinlich wird Irland das einzige europäische Land sein , das zum Vertrag von Lissabon eine Volksabstimmung durchführt .","translate English to German: Mr President , it is highly likely that Ireland will be the only European country to hold a referendum on the Lisbon Treaty ."
772,"Mr President , without a shadow of a doubt there has recently been movement on the Cypriot question and I think that the main reason for this movement is the application of Cyprus to join the European Union .","Herr Präsident , zweifelsohne gibt es in letzter Zeit Bewegung in der Sache Zyperns , und ich glaube , daß der Hauptgrund für diese Bewegung der EU-Beitrittsantrag Zyperns ist .","translate English to German: Mr President , without a shadow of a doubt there has recently been movement on the Cypriot question and I think that the main reason for this movement is the application of Cyprus to join the European Union ."
773,"For instance , it is not clear which way to rotate the dial in order to activate a certain program .","So weiß man zunächst nicht , in welche Richtung man drehen muss , um ein bestimmtes Programm zu aktivieren .","translate English to German: For instance , it is not clear which way to rotate the dial in order to activate a certain program ."
774,"Fishermen , as we all know , need to be included in the process .","Die Fischer müssen , wie wir alle wissen , in den Prozess einbezogen werden .","translate English to German: Fishermen , as we all know , need to be included in the process ."
775,"I hope that we will all be able to hold a more detailed debate on the White Paper , which will include the practical experience of businesses .","Ich wünsche uns allen , dass wir beim Weißbuch ausführlicher debattieren und Erfahrungen der Betriebspraktika einbeziehen .","translate English to German: I hope that we will all be able to hold a more detailed debate on the White Paper , which will include the practical experience of businesses ."
776,"It forms and resounds in spaces , permits events to come to the fore , creates gestalts and gives direction to time &apos;s passing .","Sie gestaltet und erklingt in Räumen , lässt Ereignisse in den Vordergrund treten , bildet Formen und gibt Verläufen eine Richtung .","translate English to German: It forms and resounds in spaces , permits events to come to the fore , creates gestalts and gives direction to time &apos;s passing ."
778,"Surely , in this modern day and age there is a better way in which we can carry this out ?",In der heutigen modernen Zeit gibt es sicherlich bessere Methoden .,"translate English to German: Surely , in this modern day and age there is a better way in which we can carry this out ?"
780,"If you are given the option to roll the dice , click PASS if you would like to pass on the opportunity .","Wenn Sie mit Würfeln an der Reihe sind , klicken Sie auf WEITERGEBEN , um weiterzugeben .","translate English to German: If you are given the option to roll the dice , click PASS if you would like to pass on the opportunity ."
781,"If you have ideas , please help me out and pass them on to me .","Und was diese Ideen betrifft , so bitte ich Sie , mir zu helfen , mir solche Ideen zu übermitteln .","translate English to German: If you have ideas , please help me out and pass them on to me ."
783,"( PL ) Madam President , China &apos;s interest in African oil , precious metals and gas is beginning to be a little reminiscent of the old colonial policies of certain European powers .","( PL ) Frau Präsidentin ! Chinas Interesse an Afrikas Öl , Edelmetallen und Gas erinnert allmählich ein bisschen an die alte Kolonialpolitik bestimmter europäischer Großmächte .","translate English to German: ( PL ) Madam President , China &apos;s interest in African oil , precious metals and gas is beginning to be a little reminiscent of the old colonial policies of certain European powers ."
784,"We find ourselves in the middle of an economic crisis and , as a consequence , we must pull together in order to reduce costs and increase the interoperability of the military capacity of our Member States .","Wir befinden uns inmitten einer Wirtschaftskrise und müssen daher an einem Strang ziehen , um Kosten zu reduzieren und die Interoperabilität der militärischen Kapazitäten unserer Mitgliedstaaten zu erhöhen .","translate English to German: We find ourselves in the middle of an economic crisis and , as a consequence , we must pull together in order to reduce costs and increase the interoperability of the military capacity of our Member States ."
785,"That , in any case , is the message which the Committee on Development and Cooperation has asked me to pass on to you .","Das ist zumindest die Botschaft , die ich Ihnen im Auftrag des Ausschusses für Entwicklung zu überbringen habe .","translate English to German: That , in any case , is the message which the Committee on Development and Cooperation has asked me to pass on to you ."
786,Discover our pages Belgium in a nutshell !,"Dann besuchen Sie folgende Webseiten : Belgien , kurz und bündig !",translate English to German: Discover our pages Belgium in a nutshell !
787,"You are all alone to struggle against the 1983 brains , beat it to the end and , well , maybe relive the levels you have already completed or even tailor them to your taste by using the in-built level editor .","kontrolliert werden . Sie sind ganz allein gegen die 1983-Hirne zu kämpfen , sie zu besiegen , und , vielleicht , die beendeten Levels neu zu erleben oder sogar sie nach Ihrem Geschmack mit dem eingebauten Level Editor umzuarbeiten .","translate English to German: You are all alone to struggle against the 1983 brains , beat it to the end and , well , maybe relive the levels you have already completed or even tailor them to your taste by using the in-built level editor ."
788,Collected data are for internal use only . Joachim Behrens Scheessel GmbH does not pass on data to third parties .,Die joachim behrens scheessel gmbh verwendet die erhobenen Daten nur für den internen Gebrauch und gibt diese nicht an Dritte weiter .,translate English to German: Collected data are for internal use only . Joachim Behrens Scheessel GmbH does not pass on data to third parties .
789,"In this debate , we have heard a number of specific pointers , which we shall obviously not fail to pass on .","In dieser Aussprache haben wir einige konkrete Signale gehört , deren Übermittlung wir natürlich nicht versäumen werden .","translate English to German: In this debate , we have heard a number of specific pointers , which we shall obviously not fail to pass on ."
790,"We will now also be writing to the governments , and I know that , in every case , the Commission ’ s insights will be accepted – nobody disputes that – and that all the governments will be cooperative , so I believe that we will be able to sort the problems out .","Wir werden auch jetzt den Regierungen entsprechende Briefe schreiben , und ich weiß , dass in allen Fällen die Erkenntnisse der Kommission akzeptiert werden – niemand bestreitet das – und dass alle Regierungen kooperativ sind . Deshalb glaube ich auch , dass wir in der Lage sein werden , die Probleme zu lösen .","translate English to German: We will now also be writing to the governments , and I know that , in every case , the Commission ’ s insights will be accepted – nobody disputes that – and that all the governments will be cooperative , so I believe that we will be able to sort the problems out ."
791,We welcome the Agreement although it is not our role to pass judgment on it .,"Wir begrüßen das Abkommen , obwohl es nicht unsere Aufgabe ist , darüber zu urteilen .",translate English to German: We welcome the Agreement although it is not our role to pass judgment on it .
792,"Does the Chair intend to pass on a simple courtesy message to parliamentarians , to officials working for the political groups , officials of Parliament and everyone else who works there and who is a French national - on behalf of everyone here of course .","Beabsichtigt die Präsidentschaft , aus Höflichkeit - wohlverstanden , im Namen aller - , eine einfache Botschaft an die Parlamentarier , an das Personal der Fraktionen , an das Personal des Parlaments und dessen Dienststellen zu richten , die französische Staatsangehörige sind ?","translate English to German: Does the Chair intend to pass on a simple courtesy message to parliamentarians , to officials working for the political groups , officials of Parliament and everyone else who works there and who is a French national - on behalf of everyone here of course ."
