,en,de,en_task
1142,"New Year , new president : Interview with new CNE-President Stephen Pollard ... JNE 3.2 in a nutshell : What the new Journal for the New Europe brings you ... Goodbye , Milton : A tribute to Milton Friedman by Normann Barry ... Breeding ground for innovation : On a new book by Gerhard Schwarz and Ronald Clapham ...","Neues Jahr , neuer Präsident : Interview mit dem neuen CNE-Präsidenten Stephen Pollard ... JNE 3.2 kurzgefaßt : Zur neuen Ausgabe des Journal for the New Europe ... Goodbye , Milton : Normann Barrys Nachruf auf Milton Friedman ... Innovationshumus : Zum Buch von Gerhard Schwarz und Ronald Clapham ...","translate English to German: New Year , new president : Interview with new CNE-President Stephen Pollard ... JNE 3.2 in a nutshell : What the new Journal for the New Europe brings you ... Goodbye , Milton : A tribute to Milton Friedman by Normann Barry ... Breeding ground for innovation : On a new book by Gerhard Schwarz and Ronald Clapham ..."
1143,"In our five Austrian lounges ( two Business Lounges , two Senator Lounges and an HON Circle Lounge ) you can relax , enjoy a snack , read the paper , do some work or recharge your batteries . The time till take-off flies by as our staff take care of all the check-in formalities on your behalf !","In den fünf Austrian Lounges ( zwei Business Lounges , zwei Senator Lounges und eine HON Circle Lounge ) können Sie sich erholen , einen frischen Imbiss nehmen , Zeitung lesen , arbeiten , Kraft tanken - und genz nebenbei checken unsere Mitarbeiter Sie ein .","translate English to German: In our five Austrian lounges ( two Business Lounges , two Senator Lounges and an HON Circle Lounge ) you can relax , enjoy a snack , read the paper , do some work or recharge your batteries . The time till take-off flies by as our staff take care of all the check-in formalities on your behalf !"
1144,"Please pass on our thanks to all concerned , especially Marco and Anna on the guided tours .","Bitte leiten Sie unseren Dank allen Beteiligten weiter , insbesondere Marco und Anna von der Tour .","translate English to German: Please pass on our thanks to all concerned , especially Marco and Anna on the guided tours ."
1145,"Unfortunately , this new requirement for new buildings will not help us with the 20-20-20 targets , especially because , increasingly , we realise that we need to be looking at at least a 30 % greenhouse gas emission reduction .","Leider wird uns diese neue Anforderung für neue Gebäude nicht bei den 20-20-20-Zielen helfen , besonders , weil wir zunehmend erkennen , dass wir eine Reduktion der Treibhausgasemissionen um mindestens 30 % in Betracht ziehen werden müssen .","translate English to German: Unfortunately , this new requirement for new buildings will not help us with the 20-20-20 targets , especially because , increasingly , we realise that we need to be looking at at least a 30 % greenhouse gas emission reduction ."
1146,"The President-in-Office has come here to listen to what I have to say - or at least , I hope he has !","Der Ratspräsident ist angereist , um meine Ausführungen zu hören . Das hoffe ich zumindest !","translate English to German: The President-in-Office has come here to listen to what I have to say - or at least , I hope he has !"
1147,"16 Behold , it came to pass on the morrow that the multitude gathered themselves together , and they both saw and heard these children ; yea , even a babes did open their mouths and utter marvelous things ; and the things which they did utter were b forbidden that there should not any man write them .","16 siehe , es begab sich : Am nächsten Tag versammelte sich die Menge , und sie sahen und hörten diese Kinder ; ja , selbst a Säuglinge öffneten den Mund und redeten Wunderbares ; und es wurde verboten , daß jemand das niederschriebe , was sie redeten .","translate English to German: 16 Behold , it came to pass on the morrow that the multitude gathered themselves together , and they both saw and heard these children ; yea , even a babes did open their mouths and utter marvelous things ; and the things which they did utter were b forbidden that there should not any man write them ."
1148,It is understandable that transit states want to pass more of the external costs of road transport on to users .,"Die Transitstaaten versuchen verständlicherweise , die externen Straßenverkehrskosten stärker auf die Nutzer zu übertragen , was verständlich ist .",translate English to German: It is understandable that transit states want to pass more of the external costs of road transport on to users .
1149,"I will , of course , pass on your comments and your wishes to the President .",Ich werde dem Präsidenten selbstverständlich Ihren Redebeitrag und den von Ihnen geäußerten Wunsch übermitteln .,"translate English to German: I will , of course , pass on your comments and your wishes to the President ."
1150,"With &quot; PDF / A in a Nutshell &quot; , the user gets a look behind the scenes of the standards and a practical guidance on how to create standard compliant PDF / A documents in his work environment .","Mit „ PDF / A kompakt “ erhält der Anwender einen Blick hinter die Kulissen des Standards und praktische Anleitungen , wie er in seiner Arbeitsumgebung standardkonformes PDF / A erzeugen kann .","translate English to German: With &quot; PDF / A in a Nutshell &quot; , the user gets a look behind the scenes of the standards and a practical guidance on how to create standard compliant PDF / A documents in his work environment ."
1151,"Because of the small production lots many of these models sell out right after release , so hurry up to get yours ...",- Wegen der kleinen Auflagen sind die Modelle immer sehr schnell ausverkauft .,"translate English to German: Because of the small production lots many of these models sell out right after release , so hurry up to get yours ..."
1152,I will pass on your words of sympathy to the victims and to the people of my country .,Ich werde Ihre Worte der Anteilnahme an die Opfer und an die Bevölkerung in meinem Land weiterleiten .,translate English to German: I will pass on your words of sympathy to the victims and to the people of my country .
1153,Los cancajos is one of the best places to go diving on the island .,Der Los Cancajos Strand ist einer der besten Orte zum Tauchen .,translate English to German: Los cancajos is one of the best places to go diving on the island .
1154,"With Senators Patrick Leahy and Chuck Grassley , Kaufman worked last year to pass a bill providing timely resources to federal law enforcement agencies working on recent financial fraud .","Zusammen mit den Senatoren Patrick Leahy und Chuck Grassley arbeitete Kaufman im letzten Jahr daran , ein Gesetz zu verabschieden , das den US-Vollzugsbehörden , die an den jüngsten Fällen von Finanzbetrug arbeiten , rechtzeitig Ressourcen zur Verfügung stellt .","translate English to German: With Senators Patrick Leahy and Chuck Grassley , Kaufman worked last year to pass a bill providing timely resources to federal law enforcement agencies working on recent financial fraud ."
1155,"I will pass your comments on to the President of Parliament , who will raise the matter at the Conference of Presidents . ( 1 )","Ich werde Ihre Bemerkungen an den Präsidenten des Parlaments weiterleiten , der die Angelegenheit in der Konferenz der Präsidenten zur Sprache bringen wird . ( 1 )","translate English to German: I will pass your comments on to the President of Parliament , who will raise the matter at the Conference of Presidents . ( 1 )"
1156,"16 And it came to pass that he said unto the people : Gather together on the morrow , for I shall die ; wherefore , I desire to speak unto the people before I shall die .","16 Und es begab sich : Er sprach zum Volk : Versammelt euch morgen , denn ich werde sterben ; darum möchte ich zum Volk sprechen , bevor ich sterbe .","translate English to German: 16 And it came to pass that he said unto the people : Gather together on the morrow , for I shall die ; wherefore , I desire to speak unto the people before I shall die ."
1157,That &apos;s why we want to pass on our know-how and experience to you .,Deshalb wollen wir unser Know-how und unsere Erfahrungen an Sie weiter geben .,translate English to German: That &apos;s why we want to pass on our know-how and experience to you .
1158,We will pass your personal data on to third parties only insofar as it is absolutely required for the provision of the requested service .,"Wir werden Ihre personenbezogenen Daten nur insoweit an Dritte weitergeben , wie es zur Erbringung des nachgefragten Service unbedingt erforderlich ist .",translate English to German: We will pass your personal data on to third parties only insofar as it is absolutely required for the provision of the requested service .
1159,"Is it not perhaps also the case that Europe cannot now afford to lose face by withdrawing , or does not know what other solutions it could conjure up to ensure coexistence and a common future ?","Und stimmt es nicht vielleicht auch , dass Europa sich jetzt keinen Gesichtsverlust durch einen Rückzug leisten kann oder nicht weiß , welche anderen Lösungen es herbeizaubern kann , um eine Koexistenz und eine gemeinsame Zukunft zu sichern ?","translate English to German: Is it not perhaps also the case that Europe cannot now afford to lose face by withdrawing , or does not know what other solutions it could conjure up to ensure coexistence and a common future ?"
1161,For example if you click on a search result in Google the site you are visiting will be able to know you came from Google and which keywords you have used .,Das hei � t wenn sie Zum Beispiel auf Google ein Suchergebnis anklicken kann die Seite erfassen dass Sie von Google kommen .,translate English to German: For example if you click on a search result in Google the site you are visiting will be able to know you came from Google and which keywords you have used .
1162,It was accepted today in the Commission . I am happy to pass it on to Members of Parliament .,"Inzwischen liegt uns eine umfassende Übersicht vor , die heute von der Kommission angenommen wurde und die ich gern an die Abgeordneten des Parlaments weiterreiche .",translate English to German: It was accepted today in the Commission . I am happy to pass it on to Members of Parliament .
1163,"It is a good feeling , while everyday practising these things , that there are so many men , who take care about it . Great - THANKS !","Danke übrigens auch für die lieben Emails , wo Ihr mich bestärkt , dass ich weitermache .","translate English to German: It is a good feeling , while everyday practising these things , that there are so many men , who take care about it . Great - THANKS !"
1164,It will then go round the world from east to west with five ports of call .,"Sie nimmt dann an der Weltumrundung von Ost nach West , mit fünf Zwischenstopps teil .",translate English to German: It will then go round the world from east to west with five ports of call .
1165,I know that my colleagues will be happy to respond to the honourable Member in order to keep him informed with any information they are able to obtain .,"Ich weiß , daß meine Kollegen dem Abgeordneten gern antworten und ihn über alle Informationen , die sie erhalten können , auf dem Laufenden halten werden .",translate English to German: I know that my colleagues will be happy to respond to the honourable Member in order to keep him informed with any information they are able to obtain .
1166,"Finally , I hope , Commissioner Rehn , that you will pass on our best wishes to Commissioner Dimas .","Abschließend hoffe ich , Herr Kommissar Rehn , dass Sie unsere besten Wünsche an Herrn Kommissar Dimas weiterleiten werden .","translate English to German: Finally , I hope , Commissioner Rehn , that you will pass on our best wishes to Commissioner Dimas ."
1167,I would therefore also like to pass on our congratulations for having achieved an agreement in that area .,Daher möchte ich Ihnen stellvertretend unsere Glückwünsche für das Erzielen einer Einigung auf diesem Gebiet aussprechen .,translate English to German: I would therefore also like to pass on our congratulations for having achieved an agreement in that area .
1168,This is not an acceptable situation in this day and age .,Das ist heutzutage keine annehmbare Situation .,translate English to German: This is not an acceptable situation in this day and age .
1169,"We deliberately supported what might be called recreational training , as we were aware that some people who left the formal education system with the feeling of having failed - Mr Purvis stressed this point earlier and , incidentally , Mr Purvis , I have taken note of your suggestion for a research programme and I shall pass this on to my fellow Commissioners , Mr Busquin and Mrs Reding - people , young people , and not only young people , who leave the educational system with the feeling of having failed must be gradually won back to the idea that learning can be useful , pleasant and can instil self-confidence .","Wir haben bewusst etwas unterstützt , das man als &quot; Lernen zum Zeitvertreib &quot; bezeichnen könnte , weil wir wussten , dass einige Menschen das offizielle Bildungssystem mit einem Gefühl des Misserfolgs hinter sich gelassen haben - Herr Purvis hat diese Tatsache soeben erwähnt . Ich habe zudem Ihren Vorschlag für ein Forschungsprogramm zur Kenntnis genommen , Herr Purvis , und werde ihn meinen Kollegen Pierre Busquin und Viviane Reding übermitteln - Menschen , junge Menschen , aber nicht nur die jungen , die ihre Ausbildungszeit nur unter dem Zeichen des Misserfolgs betrachten , müssen nach und nach wieder von der Idee überzeugt werden , dass Lernen nützlich sein , Spaß machen und neues Selbstbewusstsein verleihen kann .","translate English to German: We deliberately supported what might be called recreational training , as we were aware that some people who left the formal education system with the feeling of having failed - Mr Purvis stressed this point earlier and , incidentally , Mr Purvis , I have taken note of your suggestion for a research programme and I shall pass this on to my fellow Commissioners , Mr Busquin and Mrs Reding - people , young people , and not only young people , who leave the educational system with the feeling of having failed must be gradually won back to the idea that learning can be useful , pleasant and can instil self-confidence ."
1170,"It might mean increased costs , which the service providers would have to pass on to their passengers , a factor that might further hit this industry hard at a time when it is under pressure from low-cost flights and coach travel .","Das kann zu erhöhten Kosten führen , die die Dienstleister auf ihre Fahrgäste umlegen müssen , was dieser Branche , die bereits starker Konkurrenz durch Billigflug- und Busreiseanbieter ausgesetzt ist , einen schweren Schlag versetzen würde .","translate English to German: It might mean increased costs , which the service providers would have to pass on to their passengers , a factor that might further hit this industry hard at a time when it is under pressure from low-cost flights and coach travel ."
1171,"This book and the knowledge in it are meant to be your eyes to get that picture of personal achievement on the stony ways to develop our souls and should enable you to keep this picture in mind , so that you can enjoy the path and help others who are facing similar missions .","Der Weise Mensch unterscheidet sich vom Dummkopf unter anderm auch dadurch , dass der Weise Mensch sich zu jeder Zeit voll bewusst ist , dass auch die intelligentesten und auch die am denkaber besten ausgebildeten Menschen , verglichen mit dem gasamten Wissensschatz im Universum extrem dumme Wesen sind .","translate English to German: This book and the knowledge in it are meant to be your eyes to get that picture of personal achievement on the stony ways to develop our souls and should enable you to keep this picture in mind , so that you can enjoy the path and help others who are facing similar missions ."
1172,First listen to what I have to say !,"Ja , nun hören Sie doch erst einmal zu !",translate English to German: First listen to what I have to say !
1173,It is also easy to hire a car or take a taxi to these spots .,Ansonsten ist es auch kein Problem sich ein Auto zu mieten oder mit dem Taxi zu fahren .,translate English to German: It is also easy to hire a car or take a taxi to these spots .
1175,First and second level support pass on orders to the technical department in a co-ordinated manner .,"First und Second Level Support müssen koordiniert , Bestellungen an die Fachabteilung weitergeleitet werden .",translate English to German: First and second level support pass on orders to the technical department in a co-ordinated manner .
1176,"Secondly , because revising the Stability Pact would amount to indicating that we wish to pass this burden on to future generations , and that is certainly not a confidence booster .","Zweitens , weil die Revision des Stabilitätspakts einem Signal gleichkäme , dass wir diese Lasten auf künftige Generationen abwälzen wollten , was nicht zur Stärkung des Vertrauens beiträgt .","translate English to German: Secondly , because revising the Stability Pact would amount to indicating that we wish to pass this burden on to future generations , and that is certainly not a confidence booster ."
1177,"This will perhaps allow us to fight together still more effectively against clandestine immigration and to promote the development , in a nutshell , of democracy .","So können wir vielleicht noch effektiver gemeinsam gegen illegale Einwanderung kämpfen und , kurz gesagt , die Entwicklung von Demokratie fördern .","translate English to German: This will perhaps allow us to fight together still more effectively against clandestine immigration and to promote the development , in a nutshell , of democracy ."
1178,"In this day and age we can no longer ask women to have more children for the good of society and devote themselves to motherhood , and also expect them to bear all the financial consequences on their shoulders .","Wir können die Frauen heutzutage nicht mehr auffordern , zum Wohle der Gesellschaft mehr Kinder zu gebären und Mutterpflichten zu übernehmen , und gleichzeitig von ihnen erwarten , die finanziellen Folgen allein zu tragen .","translate English to German: In this day and age we can no longer ask women to have more children for the good of society and devote themselves to motherhood , and also expect them to bear all the financial consequences on their shoulders ."
1179,Even manufacturers of quality clothing are feeling the pinch of growing cost pressure which they are forced to pass on to their suppliers .,"Auch Hersteller hochwertiger Konfektionsware sehen sich einem steigenden Kostendruck ausgesetzt , den sie an Zulieferanten weitergeben .",translate English to German: Even manufacturers of quality clothing are feeling the pinch of growing cost pressure which they are forced to pass on to their suppliers .
1180,Your company : Talk to us and we take care of the rest !,"Ihre Gesellschaft : Sagen Sie uns , was Sie wollen , wir machen den Rest !",translate English to German: Your company : Talk to us and we take care of the rest !
1181,That implies that the competent services ask other police services and individual police officers to gather and pass on the necessary information in a goal-oriented way .,"Dies bedeutet ebenfalls , dass die zuständigen Dienststellen konkrete Aufgaben an die anderen Polizeidienste oder an die einzelnen Polizeibeamten übertragen , in dem Ziel , zielorientiert die benötigten Informationen zu sammeln und zu übermitteln .",translate English to German: That implies that the competent services ask other police services and individual police officers to gather and pass on the necessary information in a goal-oriented way .
1182,"Madam President , once again we have to pass a resolution on Kenya - as we did last July - and we have to do so because the Nairobi military authorities continue to promote tension in that country .","Frau Präsidentin , auch im Falle Kenias sehen wir uns zur erneuten Vorlage eines Entschließungsantrags veranlaßt - wir hatten im Juli dieses Jahres einen Entschließungsantrag vorgelegt - , und der Grund für die erneute Behandlung liegt darin , daß von den Militärbehörden in Nairobi die Spannung in jenem Lande weiterhin geschürt wird .","translate English to German: Madam President , once again we have to pass a resolution on Kenya - as we did last July - and we have to do so because the Nairobi military authorities continue to promote tension in that country ."
1183,"In the event of a delay in delivery for which FRIMO is not responsible , every risk will pass to the purchaser on the day it receives notification that the goods are ready for dispatch .",Bei von FRIMO nicht zu vertretender Lieferverzögerung geht jede Gefahr mit dem Tag des Zugangs der Versandbereitschaft an den Besteller auf diesen über .,"translate English to German: In the event of a delay in delivery for which FRIMO is not responsible , every risk will pass to the purchaser on the day it receives notification that the goods are ready for dispatch ."
1185,"In a nutshell , we need to invest less in asphalt , concrete and roads , and more in research infrastructure and training our people .","Kurzum , wir müssen weniger in Asphalt , Beton und Straßen und vermehrt in Forschungsinfrastrukturen und die Ausbildung unserer Bevölkerung investieren .","translate English to German: In a nutshell , we need to invest less in asphalt , concrete and roads , and more in research infrastructure and training our people ."
1186,These also serve to pass on the unequivocal message to employers that we shall no longer tolerate the recruitment of workers without a permit .,"Diese dienen ferner dazu , den Arbeitgebern unmissverständlich zu verstehen zu geben , dass wir die Einstellung von Arbeitnehmern ohne entsprechende Erlaubnis nicht mehr länger tolerieren werden .",translate English to German: These also serve to pass on the unequivocal message to employers that we shall no longer tolerate the recruitment of workers without a permit .
1187,"The design of the production facilities enable components and materials to pass from delivery on one side of the building to dispatch , where you find the finished product , to the other side of the building .",Großzügige Raumverhältnisse in der Produktion erlauben den effizienten Materialfluss von der Anlieferung der Werkstoffe auf der einen Seite des Gebäudes bis zum Versand der fertigen Geräte auf der anderen .,"translate English to German: The design of the production facilities enable components and materials to pass from delivery on one side of the building to dispatch , where you find the finished product , to the other side of the building ."
1188,"It has now become clear that the European Union is not equal to Turkey &apos;s insolent way of negotiating , which my colleague described , somewhat sarcastically but perfectly accurately , as bazaar-style haggling .","Deutlich geworden ist nun , dass die Europäische Union der unverschämten - von meinem Kollegen etwas sarkastisch , aber durchaus treffend als basarmäßiges Feilschen bezeichneten - Verhandlungstaktik der Türkei nicht gewachsen ist .","translate English to German: It has now become clear that the European Union is not equal to Turkey &apos;s insolent way of negotiating , which my colleague described , somewhat sarcastically but perfectly accurately , as bazaar-style haggling ."
1191,"I met members of their families in April , and I should like to pass on to them our solidarity and support at this difficult time .","Ich habe im April einige der Familienangehörigen getroffen , und ich möchte sie unserer Solidarität und Unterstützung in dieser schweren Zeit versichern .","translate English to German: I met members of their families in April , and I should like to pass on to them our solidarity and support at this difficult time ."
1193,I will pass on that observation to the relevant authorities in the Commission .,Ich werde diese Anmerkungen an die zuständigen Stellen der Kommission weiterleiten .,translate English to German: I will pass on that observation to the relevant authorities in the Commission .
1194,It is unfortunate that this debate has come to the fore at this stage in the review of the telecom package ; I think that it would be out of place to discuss mechanisms for ensuring full respect for intellectual property rights here .,"Ich bedauere , dass die Beratung des Telekompakets so stark von dieser Problematik überlagert wurde , denn ich denke nicht , dass dies der geeignete Rahmen ist , um Mechanismen zur Gewährleistung der vollen Einhaltung des Autorenrechts zu erörtern .",translate English to German: It is unfortunate that this debate has come to the fore at this stage in the review of the telecom package ; I think that it would be out of place to discuss mechanisms for ensuring full respect for intellectual property rights here .
1195,I will pass on your comments to the Bureau but as regards the TV system we have considered this question before .,"Ich werde Ihre Bemerkungen an das Büro weiterleiten , aber was das Fernsehsystem angeht , so haben wir die Frage bereits erörtert .",translate English to German: I will pass on your comments to the Bureau but as regards the TV system we have considered this question before .
