,en,de,en_task
0,"In this day and age , when evidently many find the money and the means to come to Europe and seek asylum , asylum procedures must be strict and straightforward .","In einer Zeit wie dieser , in der viele offensichtlich die Mittel und Wege finden , um nach Europa zu gelangen und um Asyl nachzusuchen , müssen Asylverfahren sachlich und strikt sein .","translate English to German: In this day and age , when evidently many find the money and the means to come to Europe and seek asylum , asylum procedures must be strict and straightforward ."
1,"In Romania , the election campaign will be a chance to hold discussions on interesting issues concerning the European Union : the future of the EU , the Constitutional Treaty , the next enlargement , internal reform , the efficiency of the European institutions , free access to the labour market .","In Rumänien wird der Wahlkampf die Chance bieten , wichtige Fragen über die Europäische Union zu erörtern , z. B. die Zukunft der EU , den Verfassungsvertrag , die nächste Erweiterung , die interne Reform , die Effizienz der EU-Organe , den freien Zugang zum Arbeitsmarkt .","translate English to German: In Romania , the election campaign will be a chance to hold discussions on interesting issues concerning the European Union : the future of the EU , the Constitutional Treaty , the next enlargement , internal reform , the efficiency of the European institutions , free access to the labour market ."
2,Let us work to close the back door to illegal immigration more effectively by offering legal opportunities to those wishing to settle here and integrating them properly in our society .,"Gemeinsam sollten wir wirksam die Schlupflöcher für die illegale Einwanderung schließen , indem wir denjenigen , die sich hier niederlassen wollen , legale Möglichkeiten bieten und sie ordnungsgemäß in unsere Gesellschaft integrieren .",translate English to German: Let us work to close the back door to illegal immigration more effectively by offering legal opportunities to those wishing to settle here and integrating them properly in our society .
3,"The region is easily reached by rail ( international fast trains , expresses and INTERCITY and EUROCITY trains stop at Olomouc and Přerov , from which it is easy to take trains to other towns .","Das Gebiet ist mit der Eisenbahn erreichbar , internationale Schnellzüge , Intercity- und Eurocityzüge fahren nach „ Olomouc “ und „ Přerov “ , von hier aus kommen Sie per Eisenbahn zu anderen Örtlichkeiten . Aus Ostrava oder Prag kommen Sie leicht mit dem Zug SuperCity ( Pendolino ) nach Olomouc .","translate English to German: The region is easily reached by rail ( international fast trains , expresses and INTERCITY and EUROCITY trains stop at Olomouc and Přerov , from which it is easy to take trains to other towns ."
4,"I cannot enter into debate , but I pass on that information to you so that you know the reasoning .","Ich kann mich auf keine Diskussion einlassen , aber ich leite diese Informationen an Sie weiter , damit Sie die Gründe kennen .","translate English to German: I cannot enter into debate , but I pass on that information to you so that you know the reasoning ."
5,"Axarquia is a region with many things to see , places to go and small details to notice while taking a walk through this beautiful region .","Die Axarquia ist ein abwechslungsreiche Region und bietet viele Orte , die einen Besuch wert sind , um Ihre Ferien in Torrox zu geniessen .","translate English to German: Axarquia is a region with many things to see , places to go and small details to notice while taking a walk through this beautiful region ."
6,It is in Werner Otto &apos;s nature to be forward-looking and to always see the bigger picture .,"Es entspricht dem Naturell von Werner Otto , seinen Blick stets in die Zukunft zu richten und in großen Zusammenhängen zu denken .",translate English to German: It is in Werner Otto &apos;s nature to be forward-looking and to always see the bigger picture .
7,"At present , it is probably premature to pass overall judgment on the European Union ’ s keeping of this promise .",Es ist wahrscheinlich derzeit noch zu früh für ein umfassendes Urteil über die Einhaltung dieser Zusage durch die Europäische Union .,"translate English to German: At present , it is probably premature to pass overall judgment on the European Union ’ s keeping of this promise ."
8,"We need time to reflect , because what emerged in the heat of the moment is certainly worrying .","Wir brauchen Zeit zum Nachdenken , denn das , was in der Hitze des Augenblicks entstanden ist , beunruhigt uns wirklich .","translate English to German: We need time to reflect , because what emerged in the heat of the moment is certainly worrying ."
10,"On the other hand , it is clear that the best way to reduce the threat posed to nuclear installations , or any other installation , by the possibility of terrorists deliberately crashing an aircraft into them , is to make it impossible , or extremely improbable , that they may hijack a large commercial aircraft in the first place .","Auf der anderen Seite kann die Bedrohung für die kerntechnischen und anderen Anlagen durch die Möglichkeit , dass Terroristen gezielt ein Flugzeug gegen sie lenken , am besten reduziert werden , indem die Entführung eines großen kommerziellen Flugzeugs unmöglich oder höchst unwahrscheinlich gemacht wird .","translate English to German: On the other hand , it is clear that the best way to reduce the threat posed to nuclear installations , or any other installation , by the possibility of terrorists deliberately crashing an aircraft into them , is to make it impossible , or extremely improbable , that they may hijack a large commercial aircraft in the first place ."
11,It is also becoming increasingly clear to us how organized crime is forcing its way into the Union &amp; # x02BC ; s own areas of cooperation .,"Wir bekommen auch immer deutlicher zu spüren , wie die organisierte Kriminalität in die Zusammenarbeitsbereiche der Union selbst eindringt .",translate English to German: It is also becoming increasingly clear to us how organized crime is forcing its way into the Union &amp; # x02BC ; s own areas of cooperation .
15,"Have those working women won at last who , on a certain March 8 , marked in history with their sweat and blood the day to day fight of women ?","Haben die Arbeiterinnen , die an einem 8. März dem täglichen Kampf der Frauen mit ihrem Schweiß und ihrem Blut geschichtliche Bedeutung verliehen haben , letztlich doch gewonnen ?","translate English to German: Have those working women won at last who , on a certain March 8 , marked in history with their sweat and blood the day to day fight of women ?"
16,"Now that monetary union has succeeded , as it were , and the first step has been taken , the way is considered to be clear to push for a common foreign and security policy and a stronger Western European Union .","Nachdem die Währungsunion sozusagen gelungen ist , der erste Schritt vollzogen ist , kann es jetzt aktiv zu einer Außen- und Sicherheitspolitik und Westeuropäischen Union kommen .","translate English to German: Now that monetary union has succeeded , as it were , and the first step has been taken , the way is considered to be clear to push for a common foreign and security policy and a stronger Western European Union ."
18,"This attractive price is only possible as we sell directly to the end customer - thus leaving out intermediate , costly sales channels such as wholesalers , stationary retailers or own showrooms .","Diesen Preis schaffen wir , indem wir den Zwischenhandel kategorisch ausschließen und keine eigenen Showrooms betreiben . Cubits kann man ausschließlich online planen und bestellen .","translate English to German: This attractive price is only possible as we sell directly to the end customer - thus leaving out intermediate , costly sales channels such as wholesalers , stationary retailers or own showrooms ."
19,"And here we know that more progress will have to be made in the technical measures of selectivity and protection of juvenile fish , as I have been saying again and again for a number of years now .","Und hierbei wird man , wie wir wissen , bei den technischen Maßnahmen noch mehr tun müssen , nämlich bei der Selektivität und dem Schutz von Jungfischen , wie ich in den letzten Jahren unablässig wiederholte .","translate English to German: And here we know that more progress will have to be made in the technical measures of selectivity and protection of juvenile fish , as I have been saying again and again for a number of years now ."
22,We take note of this request and will pass it on to the relevant bodies .,Wir nehmen diesen Antrag zur Kenntnis und werden ihn an die zuständigen Stellen weiterleiten .,translate English to German: We take note of this request and will pass it on to the relevant bodies .
24,That is the message I wanted to pass on to you this afternoon .,"Dies ist die Botschaft , die ich heute Nachmittag übermitteln wollte .",translate English to German: That is the message I wanted to pass on to you this afternoon .
25,"However , I should also like to see the Council go the extra mile by formulating clear , quantitative and specific objectives in terms of reducing the wage gap and setting up a number of child care centres .","Aber dann möchte ich auch gern Nägel mit Köpfen sehen , d. h. in Form von klaren , quantitativen und konkreten Zielen hinsichtlich der Angleichung der Lohnunterschiede und der Bereitstellung von Kindertagesplätzen .","translate English to German: However , I should also like to see the Council go the extra mile by formulating clear , quantitative and specific objectives in terms of reducing the wage gap and setting up a number of child care centres ."
26,The asset under our constitutions is the right of voters to be heard and to choose representatives who can pass laws on our behalf .,"Zu den Aktiva unserer Verfassungen gehört das Recht der Wähler , angehört zu werden und Repräsentanten zu wählen , die Gesetze für uns beschließen können .",translate English to German: The asset under our constitutions is the right of voters to be heard and to choose representatives who can pass laws on our behalf .
27,"Thank you , Mr Minister , that is what I wanted to hear .","Schönen Dank , Herr Minister , das wollte ich nämlich hören .","translate English to German: Thank you , Mr Minister , that is what I wanted to hear ."
28,I am very eager to hear what you have to say .,"Ich bin sehr gespannt , was Sie nachher sagen werden .",translate English to German: I am very eager to hear what you have to say .
29,"In a nutshell , we are working towards a recognisable and approachable European administration .",Kurzum : Wir bemühen uns um eine erkennbare und zugängliche europäische Verwaltung .,"translate English to German: In a nutshell , we are working towards a recognisable and approachable European administration ."
30,"Instead of opening the door , the EU seems determined to find covert ways to close its markets to Russian goods .","Statt die Türen zu öffnen , scheint die EU aber entschlossen , heimlich immer neue Wege zu finden , wie sie ihre Märkte vor russischen Gütern abschotten könnte .","translate English to German: Instead of opening the door , the EU seems determined to find covert ways to close its markets to Russian goods ."
31,"Mr President , honourable Members , I shall pass on the list of Commission opinions on the Amendments to Parliament &apos;s Services .",Verehrte Damen und Herren ! Ich leite die Liste der Stellungnahmen der Kommission zu den Änderungsanträgen an die Parlamentsdienste weiter .,"translate English to German: Mr President , honourable Members , I shall pass on the list of Commission opinions on the Amendments to Parliament &apos;s Services ."
32,It is easy to take the next step and declare her a man-hater and a lesbian .,"Der nächste Schritt , sie zu einer Männerhasserin und Lesbe abzustempeln , folgt auf dem Fuß .",translate English to German: It is easy to take the next step and declare her a man-hater and a lesbian .
34,"In a nutshell , Mr President of the Commission , what is our main aim : our main aim is neither more nor less a huge one - helping European citizens to understand that , apart from market forces , we are also interested in the rule of law and that , apart from economic goals , we are also setting goals to bring about integration through full legal development of the concept of citizenship : in other words , as the subjects of rights and obligations , the very backbone of law and justice .","Zusammenfassend , Herr Präsident der Kommission , welches ist die große Herausforderung ? Es ist eine gewaltige Herausforderung , und sie besteht nicht mehr und nicht weniger als darin , dem europäischen Bürger zu zeigen , daß über den Kräften des Marktes die Bestimmungen des Rechts stehen , daß es neben den wirtschaftlichen Zielen noch das Ziel gibt , Integration über die volle rechtliche Ausschöpfung des Konzepts des Bürgers zu erreichen : Das ist für einen Menschen mit Rechten und Pflichten die Achse von Recht und Gerechtigkeit .","translate English to German: In a nutshell , Mr President of the Commission , what is our main aim : our main aim is neither more nor less a huge one - helping European citizens to understand that , apart from market forces , we are also interested in the rule of law and that , apart from economic goals , we are also setting goals to bring about integration through full legal development of the concept of citizenship : in other words , as the subjects of rights and obligations , the very backbone of law and justice ."
35,If you do not want us to pass on your e-mail address to other companies or organisations please contact us at the above address .,"Wenn Sie möchten , dass Ihre E-Mailadresse nicht an andere Firmen oder Organisationen weitergeleitet wird , nehmen Sie bitte unter oben angegebener Adresse Kontakt mit uns auf .",translate English to German: If you do not want us to pass on your e-mail address to other companies or organisations please contact us at the above address .
36,"I should like Parliament to pull itself together ; I do not want it to search through all 120 paragraphs for all the dangers that can be imagined and for things that should be done , nor to add yet another list of measures which it would be impossible to implement all together and , above all , quickly .","Ich wünsche mir , daß das Parlament aufwacht und nicht in jedem der 120 Absätze alle möglichen und denkbaren Gefahren und alles , was getan werden müßte , sucht und daß es dieses Dokument nicht um eine Liste von Maßnahmen ergänzt , die als Ganzes vor allem kurzfristig unmöglich umgesetzt werden könnten .","translate English to German: I should like Parliament to pull itself together ; I do not want it to search through all 120 paragraphs for all the dangers that can be imagined and for things that should be done , nor to add yet another list of measures which it would be impossible to implement all together and , above all , quickly ."
37,It is necessary to pull all these strands together and to strike an appropriate balance .,"Es ist erforderlich , alle diese Aspekte in angemessener Ausgewogenheit miteinander zu verknüpfen .",translate English to German: It is necessary to pull all these strands together and to strike an appropriate balance .
38,"It is true that the data in question can be passed on to third countries but , as you know , it is laid down that there will be the same power of control over the correct use of such data .","Es stimmt , dass die fraglichen Daten an Drittländer weitergegeben werden können , doch wie Sie wissen , wurde dieselbe Kontrollbefugnis in Bezug auf deren korrekte Verwendung festgelegt .","translate English to German: It is true that the data in question can be passed on to third countries but , as you know , it is laid down that there will be the same power of control over the correct use of such data ."
39,This pot guarantees that the product it contains is the genuine high-quality article .,Dieser Topf steht für ein garantiert hochwertiges Produkt .,translate English to German: This pot guarantees that the product it contains is the genuine high-quality article .
40,No doubt you will pass on to him the displeasure of the European Parliament .,"Ich nehme an , daß Sie ihn über die Unzufriedenheit dieser Versammlung informieren werden .",translate English to German: No doubt you will pass on to him the displeasure of the European Parliament .
41,"With no green light from the Security Council , all that remains for them is the choice between two evils : to do nothing and consequently lose face or to take military action outside the UN with all the negative consequences that entails .","Ohne grünes Licht seitens des Sicherheitsrats bleibt ihnen nur die Wahl zwischen zwei Übeln : nichts zu unternehmen und somit das Gesicht zu verlieren oder eine Militäroperation außerhalb des Rahmens der Vereinten Nationen , mit all ihren fatalen Folgen .","translate English to German: With no green light from the Security Council , all that remains for them is the choice between two evils : to do nothing and consequently lose face or to take military action outside the UN with all the negative consequences that entails ."
42,"In this day and age of knowledge-based society , the educational level plays a significant role and is thus a decisive factor for investment .","In der modernen , immer stärker wissensbasierten Wirtschaft , spielt die Qualifikation eine maßgebliche Rolle . Sie ist ein wesentlicher Standortfaktor auch für Investitionsentscheidungen .","translate English to German: In this day and age of knowledge-based society , the educational level plays a significant role and is thus a decisive factor for investment ."
43,Will our next step be to pass legislation on cases involving the accidental release or the unintentional risks of GMOs ?,"Wird es morgen darum gehen , Gesetze über die unabsichtliche Freisetzung oder über unbeabsichtigte Risiken im Zusammenhang mit GMO zu verabschieden ?",translate English to German: Will our next step be to pass legislation on cases involving the accidental release or the unintentional risks of GMOs ?
44,To London I say : you cannot do that ; be realistic !,Dem kann ich nur entgegnen : Das ist nicht machbar ; seien Sie realistisch !,translate English to German: To London I say : you cannot do that ; be realistic !
45,"Mr President , I shall pass on Mr Seppänen &apos; s comments to my colleagues , and I assure you we will discuss the matter .","Herr Präsident ! Ich werde die Bemerkungen des Abgeordneten Seppänen an meinen Kollegen weiterleiten und verspreche , daß wir diese Fragen erörtern werden .","translate English to German: Mr President , I shall pass on Mr Seppänen &apos; s comments to my colleagues , and I assure you we will discuss the matter ."
46,"Let us see , in a nutshell , the most important factors that are affecting the level of our vitality , energy , productivity and competitiveness .","Welche sind die wichtigsten Faktoren , die das Vitalitätsniveau , die Leistungsfähigkeit und die Widerstandsfähigkeit eines Menschen wesentlich beeinflussen ?","translate English to German: Let us see , in a nutshell , the most important factors that are affecting the level of our vitality , energy , productivity and competitiveness ."
47,"If you book a plane ticket online with us , we pass on data from our reservation form e.g. to our hotel partners so that you can easily and quickly book a suitable room .","Wenn Sie bei uns online ein Flugticket buchen , geben wir Daten aus unserer Buchungsmaske z.B. an unseren Hotelpartner weiter , damit Sie einfach und schnell ein passendes Zimmer buchen können .","translate English to German: If you book a plane ticket online with us , we pass on data from our reservation form e.g. to our hotel partners so that you can easily and quickly book a suitable room ."
48,"We do not give out , sell , rent or let out our lists of custumers to outsiders .","Wir werden Ihre persönlichen Angaben , nicht verkaufen , ausleihen oder an Dritte weiterleiten .","translate English to German: We do not give out , sell , rent or let out our lists of custumers to outsiders ."
49,"It was a journey into hell ; into hell , I say !","Eine Reise in die Hölle ; in die Hölle , sage ich !","translate English to German: It was a journey into hell ; into hell , I say !"
50,"Commissioner , perhaps you could pass this message on to the next presidency : &apos; Nunca mais &apos; &#91; never again &#93; .","Vielleicht könnten Sie , Frau Kommissarin , der nächsten Ratspräsidentschaft folgende Botschaft übermitteln &apos; Nunca mais &apos; &#91; nie wieder &#93; .","translate English to German: Commissioner , perhaps you could pass this message on to the next presidency : &apos; Nunca mais &apos; &#91; never again &#93; ."
51,Pass through Lychen on the main direction to Beenz .,Durchfahren Sie Lychen auf der Hauptstraße Richtung Beenz .,translate English to German: Pass through Lychen on the main direction to Beenz .
52,The Czech Republic in a nutshell .,Die Tschechische Republik auf einem Blick .,translate English to German: The Czech Republic in a nutshell .
54,"We all know that in order not to lose face , the basis of a resolution has already been negotiated .","Ich muß Ihnen sagen , daß wir alle gut verstehen , daß bereits ein Lösungsansatz verhandelt wird , um nicht das Gesicht zu verlieren .","translate English to German: We all know that in order not to lose face , the basis of a resolution has already been negotiated ."
55,"Mugabe wants - by hook or by crook - to pursue his ill-fated policy which has led Zimbabwe to the brink of starvation , where 80 % of the population live beneath the poverty line and 60 % are unemployed .","Mugabe möchte seine katastrophale Politik , aufgrund derer Simbabwe heute vor einer Hungersnot steht , 80 % der Bevölkerung unterhalb der Armutsgrenze leben und die Arbeitslosigkeit bei 60 % liegt , auf jeden Fall fortsetzen .","translate English to German: Mugabe wants - by hook or by crook - to pursue his ill-fated policy which has led Zimbabwe to the brink of starvation , where 80 % of the population live beneath the poverty line and 60 % are unemployed ."
56,"Not being myself a lawyer either , I would be interested to know what the Commission &apos;s position would be in the event of Nice not being ratified before the Treaty expires , for then , or so my reasonable human understanding tells me , a legal vacuum results , and that is something we should have looked into .","Gerade weil ich selber auch kein Jurist bin , würde es mich einmal interessieren , wie sich die Kommission dazu stellt , wenn Nizza bis zum Ablauf des Vertrages nicht ratifiziert wird , denn da entsteht nach meinem gesunden Menschenverstand ein juristisches Vakuum , und das sollte man einmal prüfen lassen .","translate English to German: Not being myself a lawyer either , I would be interested to know what the Commission &apos;s position would be in the event of Nice not being ratified before the Treaty expires , for then , or so my reasonable human understanding tells me , a legal vacuum results , and that is something we should have looked into ."
57,"* Note : The Finding Chart , Navigate and Image Lists tools build mosaics on the fly by overlapping SDSS fields that may or may not belong to different runs .","* Hinweis : Die Finding Chart , Navigate und Image Lists Werkzeuge erstellen Mosaiks , indem sie SDSS Felder � berdecken , die zu verschiedenen L � ufen dazugeh � ren k � nnten , oder nicht .","translate English to German: * Note : The Finding Chart , Navigate and Image Lists tools build mosaics on the fly by overlapping SDSS fields that may or may not belong to different runs ."
58,Later you can fly by dirigible to the Elven Lands or drive there by submarine .,Später kannst du mit dem Luftschiff in die Elfenländer fliegen oder mit dem Unterseeboot dorthin fahren .,translate English to German: Later you can fly by dirigible to the Elven Lands or drive there by submarine .
59,"This amount of small tiles allows a fast navigation in the picture , because only those tiles have to be loaded , which are currently displayed in the picture excerpt .","Diese Vielzahl an kleinen Kacheln erlaubt ein sehr schnelles Navigieren im Bild , da immer nur die Kacheln geladen werden müssen , die gerade auf dem Bildausschnitt zu sehen sind .","translate English to German: This amount of small tiles allows a fast navigation in the picture , because only those tiles have to be loaded , which are currently displayed in the picture excerpt ."
60,We take special care of the little ones !,Ein besonderes Herz für die Kleinen !,translate English to German: We take special care of the little ones !
61,Why do we simply pass on to the existing agenda ?,Wieso gehen wir einfach zur Tagesordnung über ?,translate English to German: Why do we simply pass on to the existing agenda ?
62,"Mr Nicholson , we have taken note of your words and will naturally pass your concerns on to the Parliamentary Bureau .",Herr Nicholson ! Wir haben Ihre Worte vermerkt und werden Ihre Bedenken natürlich an das Präsidium des Parlaments weiterleiten .,"translate English to German: Mr Nicholson , we have taken note of your words and will naturally pass your concerns on to the Parliamentary Bureau ."
